name,comment,label_id
mydoviolinist,"Cảm ơn insight của mom 🙏🏻 Tui thấy là ng cãi ngu thì ở đâu cũng có, chỉ là họ cãi ngu quá xong ko có ai buồn vào correct thì đúng là chán hẳn luôn, may là tui thấy có những cmt phản biện nên vẫn còn chút niềm tin vào con người ấy 🤣 Về việc phục vụ lợi ích thì đúng là khó nói... vì mục đích mỗi ng một khác thật. Tuy nhiên nếu bóc đúng thì nên công nhận, t nghĩ vậy,T có một sở thích mới, đó là vào group Liêm chính khoa học xem người ta var nhau. Được...",0
tanh_hoc_uuni,"Thật ra nếu bà ở trong giới nghiên cứu khoa học thì sẽ biết nó không liêm chính đâu :)))))) Vào gr đọc cho vui thôi,T có một sở thích mới, đó là vào group Liêm chính khoa học xem người ta var nhau. Được...",0
mydoviolinist,"T hiểu bác đang muốn nói rằng kp cứ làm nghiên cứu, bác học các thứ là đàng hoàng. T thấy là giới nào thì cũng có những thứ k liêm chính riêng của ngành đó thui bác ah, kp mỗi NCKH. 🙂‍↕️ Với theo t thấy thì dù tnao đi chăng nữa, xem những ng có đầu óc tranh luận rõ ràng vẫn dễ chịu hơn rất nhiều so với việc nhìn mấy ng cãi nhau mà khéo ngta còn đang chẳng hiểu họ nói gì ấy 😝,T có một sở thích mới, đó là vào group Liêm chính khoa học xem người ta var nhau. Được...",0
caubena,"Trong cái grp đấy không liêm chính đâu bạn :)) đấu tố nhau là chính. Đăng bài toàn ẩn danh thì liêm chính gì nữa :)),T có một sở thích mới, đó là vào group Liêm chính khoa học xem người ta var nhau. Được...",0
nl_thuytrang,"Giới nckh mà bóc ý bác là đống phốt lun, lâu lâu em cũng zô hóng phốt lém, để xem có thầy cô nào trường đại học hay người quen nào của mình bị đem lên tế hông. Hồi trước em vẫn ngây thơ nghĩ rằng là càng học cao thì mọi người sẽ cư xử nhã nhặn, ít drama, mọi thứ liêm chính, xong giờ bị vả không còn gì, mọi thứ là lợi ích.,T có một sở thích mới, đó là vào group Liêm chính khoa học xem người ta var nhau. Được...",0
mydoviolinist,"Haha tui biết là ngành nào cũng có vùng xám, nên tui ko expect bất kì sự liêm chính tuyệt đối nào ở đây bác ah, và càng học cao, thì vấn đề (hoặc tệ nạn) càng phức tạp. Tuy nhiên ý tui đang nói ở đây là việc xem một cuộc tranh luận có đầu óc vẫn sẽ dễ tiếp thu hơn những màn cãi vã mà chính chủ còn ko hiểu mình đang cãi gì ấy 🤣,T có một sở thích mới, đó là vào group Liêm chính khoa học xem người ta var nhau. Được...",0
wtfaust_,"LCKH vẫn chưa dí đc con bán quạt giả damh tiến sĩ t chưa cam lòng,T có một sở thích mới, đó là vào group Liêm chính khoa học xem người ta var nhau. Được...",0
nnnnnan_21,"Dí được rồi nhé b,T có một sở thích mới, đó là vào group Liêm chính khoa học xem người ta var nhau. Được...",0
vietnamese_sandwich_uwo,"Với cả mình nghe ở đâu đó bảo rằng khoa học cũng ko liêm chính lắm đâu nên bn đừng kì vọng nhiều vào giới khoa học🤓,T có một sở thích mới, đó là vào group Liêm chính khoa học xem người ta var nhau. Được...",0
thuhangg287,"T ko rõ hết tất cả mn ntn, nhưng t khẳng định rất nhiều người làm nghiên cứu đang bị rối loạn lo âu và ovtk nên t ko xem nta var nhau trên đấy,T có một sở thích mới, đó là vào group Liêm chính khoa học xem người ta var nhau. Được...",0
jannachanily,"Đọc chọn lọc thôi mom ạ =))),T có một sở thích mới, đó là vào group Liêm chính khoa học xem người ta var nhau. Được...",0
rosiee_1503,"Vụ khác thì k biết chứ vụ PGS gần đây thì đúng là nâng cao khả năng phản biện nha,T có một sở thích mới, đó là vào group Liêm chính khoa học xem người ta var nhau. Được...",0
trv_cuong,"Công nhận vào đấy xem bóc phốt cũng hay,T có một sở thích mới, đó là vào group Liêm chính khoa học xem người ta var nhau. Được...",0
embeiuu.wahnee,"Thật luônnn. Siêu mê. Tranh luận mà luận điểm luận cứ rõ ràng, kiến thức bay đầy cmt huhuuuuu,T có một sở thích mới, đó là vào group Liêm chính khoa học xem người ta var nhau. Được...",0
dangmydao,"Xem ở đâu bạn nhỉ, mình cũng muốn xemm,T có một sở thích mới, đó là vào group Liêm chính khoa học xem người ta var nhau. Được...",0
embeiuu.wahnee,"Bác xem bác quan tâm chủ đề hay lĩnh vực nào thì vào group ý ấy. Tui hay quan tâm mấy cái liên quan tới pháp y này kia thì tui vào mấy gr pháp y trên facebook á,T có một sở thích mới, đó là vào group Liêm chính khoa học xem người ta var nhau. Được...",0
nguyentran.n.t,"Thật ra, mấy bài trên đó ng trong ngành nhìn vào là hiểu, dù cho lập luận có bén ngót tới đâu 😒,T có một sở thích mới, đó là vào group Liêm chính khoa học xem người ta var nhau. Được...",0
ypnchannel4u,"Cãi nhau vui mà, xả stress; Còn thảo luận thì lại khác, ít ra là nội dung trao đổi cần làm rõ và thống nhất với nhau về thuật ngữ để cùng biết là đang nói về cái gì; Cãi nhau thì không nhất định, ai nói chuyện của người đấy, có khi dùng cùng một từ nhưng mỗi người hiểu một kiểu; Có điều, thế giới có xu hướng vận hành theo kiểu cãi nhau dựa trên tham khảo nền tảng của các cuộc thảo luận.,T có một sở thích mới, đó là vào group Liêm chính khoa học xem người ta var nhau. Được...",0
yotsubayuuki,"Tui cũng mới chỉ biết đến group Liêm Chính cách đây chưa lâu thông qua vụ của Quỳnh Anh Standford, nhưng phải thừa nhận lên đó tui đã được mở mang tầm mắt và học được cách viết và cách phản biện sao cho chuẩn xác. Còn về mục đích thì kệ thui chủ yếu là lên để học tập những cái tốt mà 🥰,T có một sở thích mới, đó là vào group Liêm chính khoa học xem người ta var nhau. Được...",0
hailinh1001,"Hơ ní đọc cho vui thôi, dân làm NCKH thấy nhóm đó cũng abcxyz lắm, có một thời vin vào để đấu tố kiểu không có bằng chứng rõ ràng mà cứ châm ngọn lửa nghi ngờ đố kỵ ấy. Hồi anh Duong Tu mới lập ra khác giờ nhiều lắm,T có một sở thích mới, đó là vào group Liêm chính khoa học xem người ta var nhau. Được...",0
vietnamese_sandwich_uwo,"Tranh luận nhiều khi nó rất cực đoan í, kể cả là học thuật hay ko học thuật, bởi vì nhận thua khá là khó, đặc biệt trong giới học thuật ngta cần phải giữ mặt mũi💀 trừ tranh luận về toán lý thì chỉ có 1 chân lý, còn mấy thứ khác thì ko,T có một sở thích mới, đó là vào group Liêm chính khoa học xem người ta var nhau. Được...",0
baobao_memories,"Đến 1 câu nói tiếng Anh còn ko nói được nhưng vẫn tốt nghiệp tiến sĩ Trường top 100 thế giới,T có một sở thích mới, đó là vào group Liêm chính khoa học xem người ta var nhau. Được...",0
hatdaukyla1407,"True,T có một sở thích mới, đó là vào group Liêm chính khoa học xem người ta var nhau. Được...",0
c.loud_12345,"Group ấy nó liêm 50% thôi, nhiều bài viết trù dập nhau lắm,T có một sở thích mới, đó là vào group Liêm chính khoa học xem người ta var nhau. Được...",0
quina.34_,"bao nhiêu ảnh đẹp thì him không thích:)) thích mỗi ảnh cuối:)))) Trông khác gì nghiện k=))),bao nhiêu ảnh đẹp thì him không thích:)) thích mỗi ảnh cuối:)))) Trông khác gì nghiện k=)))",0
nhoka7top1,"lữ hành gia,bao nhiêu ảnh đẹp thì him không thích:)) thích mỗi ảnh cuối:)))) Trông khác gì nghiện k=)))",0
annabillee12,"Hôm nọ mới làm quả video du lịch ấn xong hình như đánh phụ nữ ấn ngoài đường xong😬 b gái này nghe chừng tương lai chấm hỏi khét lẹt,bao nhiêu ảnh đẹp thì him không thích:)) thích mỗi ảnh cuối:)))) Trông khác gì nghiện k=)))",0
is_hdang,"vcl lữ hành gia =)))),bao nhiêu ảnh đẹp thì him không thích:)) thích mỗi ảnh cuối:)))) Trông khác gì nghiện k=)))",0
dangminhhieu1812,"vcl goat lữ hành gia Má ngồi xem khả seni xong mò sang kênh con vợ này xong h vid l nào cũng xem,bao nhiêu ảnh đẹp thì him không thích:)) thích mỗi ảnh cuối:)))) Trông khác gì nghiện k=)))",0
le.hiuy_,"+1 giờ ăn cơm bỏ phim để xem th e,bao nhiêu ảnh đẹp thì him không thích:)) thích mỗi ảnh cuối:)))) Trông khác gì nghiện k=)))",0
lieu_nhat_huy,"Lữ hành gia là gì đấy ae?,bao nhiêu ảnh đẹp thì him không thích:)) thích mỗi ảnh cuối:)))) Trông khác gì nghiện k=)))",0
_.09nov,"du túp bơ á bạn, lữ hành gia là tên ytb của ông trong ảnh nè,bao nhiêu ảnh đẹp thì him không thích:)) thích mỗi ảnh cuối:)))) Trông khác gì nghiện k=)))",0
lieu_nhat_huy,"Ồ ra vậy,bao nhiêu ảnh đẹp thì him không thích:)) thích mỗi ảnh cuối:)))) Trông khác gì nghiện k=)))",0
co_ai_biet,"Bạn gái ơi, bạn rất dễ thương. Nhưng bạn trai kẻ lông mày à?,bao nhiêu ảnh đẹp thì him không thích:)) thích mỗi ảnh cuối:)))) Trông khác gì nghiện k=)))",0
quina.34_,"à:) ảnh thích lông mày kiếm nhật=)) tui k cản được👩🏻‍🦲,bao nhiêu ảnh đẹp thì him không thích:)) thích mỗi ảnh cuối:)))) Trông khác gì nghiện k=)))",0
hugggarcia_,"Ô lữ hành gia sena mà😹,bao nhiêu ảnh đẹp thì him không thích:)) thích mỗi ảnh cuối:)))) Trông khác gì nghiện k=)))",0
dounnuo,"Goat lữ hành gia,bao nhiêu ảnh đẹp thì him không thích:)) thích mỗi ảnh cuối:)))) Trông khác gì nghiện k=)))",0
trunggkienn_27,"Wow,bao nhiêu ảnh đẹp thì him không thích:)) thích mỗi ảnh cuối:)))) Trông khác gì nghiện k=)))",0
zn0hp,"🐐,bao nhiêu ảnh đẹp thì him không thích:)) thích mỗi ảnh cuối:)))) Trông khác gì nghiện k=)))",0
quanh28.11.05,"Chụp ở đou v ạ,bao nhiêu ảnh đẹp thì him không thích:)) thích mỗi ảnh cuối:)))) Trông khác gì nghiện k=)))",0
noturfav10_,"vcl ông em lữ hành gia,bao nhiêu ảnh đẹp thì him không thích:)) thích mỗi ảnh cuối:)))) Trông khác gì nghiện k=)))",0
mal.uyn,"Dễ thương quáaaa, hay xem vlog ny của bạn :))))))))),bao nhiêu ảnh đẹp thì him không thích:)) thích mỗi ảnh cuối:)))) Trông khác gì nghiện k=)))",0
ngohoangdeptrais1tg,"Đùa a lữ hành gia ê,bao nhiêu ảnh đẹp thì him không thích:)) thích mỗi ảnh cuối:)))) Trông khác gì nghiện k=)))",0
trunghai_11,"Ổng này giải cứu thế giới à, sao có ghẹ xinh dậy chời,bao nhiêu ảnh đẹp thì him không thích:)) thích mỗi ảnh cuối:)))) Trông khác gì nghiện k=)))",0
dzt2.16,"Lữ hành gia?,bao nhiêu ảnh đẹp thì him không thích:)) thích mỗi ảnh cuối:)))) Trông khác gì nghiện k=)))",0
_capyboi_,"Sao nhìn giống con vợ lữ hành gia thế,bao nhiêu ảnh đẹp thì him không thích:)) thích mỗi ảnh cuối:)))) Trông khác gì nghiện k=)))",0
mduong.g,"anh zai lử hành da,bao nhiêu ảnh đẹp thì him không thích:)) thích mỗi ảnh cuối:)))) Trông khác gì nghiện k=)))",0
le627tuan,"Thức ăn tại Hoa Kỳ hien giờ già cả lên mot cach khùng khiếp luôn di chợ ngay trước 100 us là ăn cả tháng con hiện giờ đi chợ cho mot người ăn thôi ma chi có để tủ lạnh àn được 5/6 ngày thôi niểu tình hình như vậy thi toi nghĩ nước Mỹ sẽ bị khủng quảng kính tế quá,Thức ăn tại Hoa Kỳ hien giờ già cả lên mot cach khùng khiếp luôn di chợ ngay trước 100...",0
abune63,"Ko có tiền thì mua miếng thịt bò thì ra cosco làm cục thịt bò $20 ăn cả tuần ko hết. Chạy vào siêu thị ăn phải Ribeye loại ngon thì kêu ca j.,Thức ăn tại Hoa Kỳ hien giờ già cả lên mot cach khùng khiếp luôn di chợ ngay trước 100...",0
hongloan020371,"Bây giờ tiền mất giá trị Ở đâu cũng vậy anh ạ,Thức ăn tại Hoa Kỳ hien giờ già cả lên mot cach khùng khiếp luôn di chợ ngay trước 100...",0
wowitstrung,"VN cũng v thôi, bịch cà phê lên giá gấp 2 lần trong vòng 1 năm,Thức ăn tại Hoa Kỳ hien giờ già cả lên mot cach khùng khiếp luôn di chợ ngay trước 100...",0
thicongduc,"Bên Đức cũng vậy,Thức ăn tại Hoa Kỳ hien giờ già cả lên mot cach khùng khiếp luôn di chợ ngay trước 100...",0
papatonkin,"buồn quá 🥴,Thức ăn tại Hoa Kỳ hien giờ già cả lên mot cach khùng khiếp luôn di chợ ngay trước 100...",0
dntran72,"Tào lao $100 ăn năn thì có, ăn cả tháng🤣🤣🤣,Thức ăn tại Hoa Kỳ hien giờ già cả lên mot cach khùng khiếp luôn di chợ ngay trước 100...",0
nguyen_8679,"Chính phủ chi phí hết. Ko lo,Thức ăn tại Hoa Kỳ hien giờ già cả lên mot cach khùng khiếp luôn di chợ ngay trước 100...",0
tp_tmh,"Ông nội lựa ngay rib eye thì hỏi sao ko mắc:)))),Thức ăn tại Hoa Kỳ hien giờ già cả lên mot cach khùng khiếp luôn di chợ ngay trước 100...",0
venus.nguyen.564,"Vn khác gì đâu,Thức ăn tại Hoa Kỳ hien giờ già cả lên mot cach khùng khiếp luôn di chợ ngay trước 100...",0
leson682018,"Tội nghiệp nước Mỹ, Việt Nam xã nghĩa chờ đô la gửi về cũng không mua nổi thức ăn độc hại ô nhiễm.. vậy mà cả đám trèo tường trốn vô container để đến xứ tư bản giãy chết..mà nhập cư.. hiện nay 28 ngàn ông hồ tặc mới bằng 1 ông Tổng thống Mỹ.. đồng hồ tặc như rác ..,Thức ăn tại Hoa Kỳ hien giờ già cả lên mot cach khùng khiếp luôn di chợ ngay trước 100...",0
yuenan_chengguan,"Vấn đề là tiền chợ như vậy chiếm bao nhiêu % thu nhập mỗi tháng của anh? Nhìn giá thịt anh mua có thể thấy là rẻ hơn ở VN rất nhiều trong khi thu nhập chắc chắn là cao hơn nhiều,Thức ăn tại Hoa Kỳ hien giờ già cả lên mot cach khùng khiếp luôn di chợ ngay trước 100...",0
greentobluecollage,"2 thằng này chiều nay ở phạm văn đồng đéo ngu à :)) uống nước xong vứt ra giữa đường, lúc sau ném cái thuốc lá nốt xong nhổ nc bọt ra giữa đường ghê vl đường đông thế này mà đ biết ngại à?,2 thằng này chiều nay ở phạm văn đồng đéo ngu à :)) uống nước xong vứt ra giữa đường,...",0
dun.07_,"Bọn tộc hòa bình,2 thằng này chiều nay ở phạm văn đồng đéo ngu à :)) uống nước xong vứt ra giữa đường,...",0
minhthai233,"Lần đầu về thủ đô!,2 thằng này chiều nay ở phạm văn đồng đéo ngu à :)) uống nước xong vứt ra giữa đường,...",0
nguyenhoseo,"Dòng thứ 28 dơ bẩn,2 thằng này chiều nay ở phạm văn đồng đéo ngu à :)) uống nước xong vứt ra giữa đường,...",0
quandui_deptong_kosomuadong,"“đéo ngu à” là chửi nó hay sao dzợ ??? 😅,2 thằng này chiều nay ở phạm văn đồng đéo ngu à :)) uống nước xong vứt ra giữa đường,...",0
greentobluecollage,"ê viết nhầm,2 thằng này chiều nay ở phạm văn đồng đéo ngu à :)) uống nước xong vứt ra giữa đường,...",0
truong_sy_toan,"2 cu Tooc xuống phố,2 thằng này chiều nay ở phạm văn đồng đéo ngu à :)) uống nước xong vứt ra giữa đường,...",0
mynguyenha3,"Thật nha tôi gặp mấy truoqngf hợp này nhiều nè có lần đang đi có ông đằng trc ném cốc rác xuống xg tôi đang lái xe vấp vào suýt ngã :(( chả biết ý thức ở đâu,2 thằng này chiều nay ở phạm văn đồng đéo ngu à :)) uống nước xong vứt ra giữa đường,...",0
__acyejit,"sv sao biết ngại,2 thằng này chiều nay ở phạm văn đồng đéo ngu à :)) uống nước xong vứt ra giữa đường,...",0
__phuong______,"1 câu thôi: Tỉnh,2 thằng này chiều nay ở phạm văn đồng đéo ngu à :)) uống nước xong vứt ra giữa đường,...",0
if_hne,"Ôi v. Có mấy thành phần cứ đánh đồng tất cả z. Chỗ nào chả có ng này ng kia. Hong biết snghi à. Mấy th trong ảnh đã z rồi mấy đứa bluan khiếm nhã cũm i chang kk,2 thằng này chiều nay ở phạm văn đồng đéo ngu à :)) uống nước xong vứt ra giữa đường,...",0
mduyen.lee,"@qmai.doo 28 hoà bình chào ae nhớ,2 thằng này chiều nay ở phạm văn đồng đéo ngu à :)) uống nước xong vứt ra giữa đường,...",0
qmai.doo,"ngại hết cả hoà bình quê tôi,2 thằng này chiều nay ở phạm văn đồng đéo ngu à :)) uống nước xong vứt ra giữa đường,...",0
thingsilike03,"Nọ t bị 1 thằng ""tổ lái"" phóng chặn đầu xe suýt bị ô tô đâm. T hoảng, ô tô cx hoảng, thằng đó la hét vui lắm😃😃,2 thằng này chiều nay ở phạm văn đồng đéo ngu à :)) uống nước xong vứt ra giữa đường,...",0
ptd31_,"@vhq__2712 m đúng không. Mang tiếng dân Lương Sơn vc,2 thằng này chiều nay ở phạm văn đồng đéo ngu à :)) uống nước xong vứt ra giữa đường,...",0
trongphan.08,"Xin hãy sống ý thức lên cho thành phố sạch đẹp sống cộng đồng đùng nhỏ mọn quá bỏ rác đubgs nơi quy định,2 thằng này chiều nay ở phạm văn đồng đéo ngu à :)) uống nước xong vứt ra giữa đường,...",0
aug15th,"T tin bạn. Nhưng sẽ có những đứa lên chửi bạn, và yêu cầu bằng chứng, kiểu video, chứ đăng lên tnay ai chả đăng được :)) T bị chửi rồi nên t biết,2 thằng này chiều nay ở phạm văn đồng đéo ngu à :)) uống nước xong vứt ra giữa đường,...",0
binhnuocthai,"Mới về làm dâu, mình lm trứng chưng cho cả nhà ăn Tuy k có màu đẹp nhưng rất ngon Mẹ ck với em gái ck nhìn rồi nói: “Mới nhìn đã thấy mắc ói rồi, nấu cho heo ăn hay gì v“ Nghe hai người nói xong mình mang nguyên cái thau trứng đó lên phòng ăn một mình Kệ hai mẹ con bả muốn ăn gì thì ăn,Mới về làm dâu, mình lm trứng chưng cho cả nhà ăn Tuy k có màu đẹp nhưng rất ngon...",0
binhnuocthai,"Son bắt sáng 3ce https://s.shopee.vn/6pssmHuyY7 Đầm vàng xinh xẻo tiểu thư https://s.shopee.vn/804qATP3sO,Mới về làm dâu, mình lm trứng chưng cho cả nhà ăn Tuy k có màu đẹp nhưng rất ngon...",0
trungon8,"Máy lọc không khí xiaomi https://s.shopee.vn/20ncsorAky,Mới về làm dâu, mình lm trứng chưng cho cả nhà ăn Tuy k có màu đẹp nhưng rất ngon...",0
minhminh_chan,"Cái này ko phải trứng chưng Thành phần m thấy rõ con rươi Ko hiểu b lên bài với mục đích j?,Mới về làm dâu, mình lm trứng chưng cho cả nhà ăn Tuy k có màu đẹp nhưng rất ngon...",0
vietnambilionare_son,"❌️nhận bãi đồ ăn trông như cức ✅️ăn 1 mình và chửi mẹ chồng,Mới về làm dâu, mình lm trứng chưng cho cả nhà ăn Tuy k có màu đẹp nhưng rất ngon...",0
thanhloan1188,"Haizz, tuy bả nói thẳng quá đáng, nhưng chế làm xấu thật, rút kinh nghiệm lần sau, khi hấp gần chín, chế lấy cái tròng đỏ trứng gà, trứng vịt, đánh ra chế thành cái lớp mỏng trên cùng, rồi rắc ít hành lá xắt nhỏ lên, vài lát ớt, đậy lại 3 phút, rắc tiêu lên là đẹp ngay í mà. Mình có lòng lụi hụi vô bếp làm món ăn ngon, thì thôi ráng chút xíu trang trí cho nó đẹp, nhìn ngon mắt thì cũng ăn ngon miệng hơn. Cái gì mình thiếu sót thì mình cứ học hỏi rút kinh nghiệm, để bản thân mình đẹp hơn tốt hơn,Mới về làm dâu, mình lm trứng chưng cho cả nhà ăn Tuy k có màu đẹp nhưng rất ngon...",0
_phwg.h,"sao đây lại là trứng chưng,Mới về làm dâu, mình lm trứng chưng cho cả nhà ăn Tuy k có màu đẹp nhưng rất ngon...",0
esme_algrn,"Bà làm trứng hấp rươi hả,Mới về làm dâu, mình lm trứng chưng cho cả nhà ăn Tuy k có màu đẹp nhưng rất ngon...",0
nguyethoa.dinh,"Trứng rán rươi thế này là bình thường =)) chắc nhà ngta kh có điều kiện ít được ăn rươi đấy,Mới về làm dâu, mình lm trứng chưng cho cả nhà ăn Tuy k có màu đẹp nhưng rất ngon...",0
toru__wetwet,"Nhìn ngon mà, lần sau mik làm thêm lần nữa sẽ đẹp hơn nè,Mới về làm dâu, mình lm trứng chưng cho cả nhà ăn Tuy k có màu đẹp nhưng rất ngon...",0
lananhh127,"Mẹ ck nói đúng còn gì,Mới về làm dâu, mình lm trứng chưng cho cả nhà ăn Tuy k có màu đẹp nhưng rất ngon...",0
kyie_6.68,"Ê đồ ăn dù hình thức thế nào thì cũng không nên nói như thế chứ. Không ăn thì để người khác ăn. Rươi ngon vcl không ăn thì nhịn.,Mới về làm dâu, mình lm trứng chưng cho cả nhà ăn Tuy k có màu đẹp nhưng rất ngon...",0
bonglantrungdai25,"Mấy ng trong cmt cứ ""cái này là rươi cái này kp trứng chưng"". Bộ rươi k chưng đc hay sao v mấy má ? Ý là nó 6 nhưng trứng với rươi chưng nó cũng chín mà ??? (T vẫn thích ăn rán hơn),Mới về làm dâu, mình lm trứng chưng cho cả nhà ăn Tuy k có màu đẹp nhưng rất ngon...",0
nell.y0415,"Nói c đừng buồn e nhìn cũng sợ thiệt nhưng là e ko nói z chỉ là mình có thể ko ăn thôi sao nói z tủi thân ngta,Mới về làm dâu, mình lm trứng chưng cho cả nhà ăn Tuy k có màu đẹp nhưng rất ngon...",0
giatran5168,"uhm, m coi qua màn hình cũng muốn ói nè:(,Mới về làm dâu, mình lm trứng chưng cho cả nhà ăn Tuy k có màu đẹp nhưng rất ngon...",0
tttl_ntc,"trứng phải có màu z t mới thích ăn 🥰,Mới về làm dâu, mình lm trứng chưng cho cả nhà ăn Tuy k có màu đẹp nhưng rất ngon...",0
thu.tolu_,"Tôi thích ăn rươi, nhưng bác nấu thế này tôi cũng không dám ăn😢,Mới về làm dâu, mình lm trứng chưng cho cả nhà ăn Tuy k có màu đẹp nhưng rất ngon...",0
vhtrang_02,"thấy rươi là thấy ngon🤤,Mới về làm dâu, mình lm trứng chưng cho cả nhà ăn Tuy k có màu đẹp nhưng rất ngon...",0
hinhinhiphip,"Chả rươi ngon thế này mà chê, tôi mê rươi vl,Mới về làm dâu, mình lm trứng chưng cho cả nhà ăn Tuy k có màu đẹp nhưng rất ngon...",0
gau.beuu,"Cả một hành trình dài kiên trì để thay đổi Mình đã làm được,Cả một hành trình dài kiên trì để thay đổi Mình đã làm được",0
nga_doan1987,"Lấy vợ là về form,Cả một hành trình dài kiên trì để thay đổi Mình đã làm được",0
gau.beuu,"bởi vẫn độc thân 🤧,Cả một hành trình dài kiên trì để thay đổi Mình đã làm được",0
therain218,"Bỏ khẩu trang mới tin là 1 người,Cả một hành trình dài kiên trì để thay đổi Mình đã làm được",0
pav.bokhoree,"Well done 💅😀♏️,Cả một hành trình dài kiên trì để thay đổi Mình đã làm được",0
gau.beuu,"thank ❤️,Cả một hành trình dài kiên trì để thay đổi Mình đã làm được",0
hejikkk_kgh,"May i ask how to loose side belly?,Cả một hành trình dài kiên trì để thay đổi Mình đã làm được",0
hibiki_tachibanatakanare,"I would love some advice or a schedule. -^-#@! You have a great body.,Cả một hành trình dài kiên trì để thay đổi Mình đã làm được",0
gau.beuu,"thank so much ❤️,Cả một hành trình dài kiên trì để thay đổi Mình đã làm được",0
ashleytran462,"Tai sao phai che mat ?,Cả một hành trình dài kiên trì để thay đổi Mình đã làm được",0
truongnguyenthanhduy,"Woa! 😃,Cả một hành trình dài kiên trì để thay đổi Mình đã làm được",0
_no_o_n_a_,"Congratulations💪,Cả một hành trình dài kiên trì để thay đổi Mình đã làm được",0
bachlan.thi.nguyen,"Đẹp trai quá sau khi tập thể dục 😍😍😍,Cả một hành trình dài kiên trì để thay đổi Mình đã làm được",0
jh1nx_,"Đại ca 67kg mà nhìn chiến đét thế,Cả một hành trình dài kiên trì để thay đổi Mình đã làm được",0
botrungga,"Bạn có bị rạn da không nhỉ? Cho mình xin tip với huhu,Cả một hành trình dài kiên trì để thay đổi Mình đã làm được",0
