name,comment,label_id
voyeucuaanh072,gói vị chocolate bỏ vô ngăn đá á ăn đỉnh vch,0
no.way.imtired,ulatr hồi bé t ăn hết mấy bịch liền trong một lúc ln,0
megauvoi102,Ơ giờ họ k ra vị việt quất nữa ạ,0
bachuchuonggaluyngainazi,"Đó đó, dụ hốc trưởng là t nữa rồi đó😞",0
meo.ok2,Chỗ t có 10nghin 1 gói á,0
minhanhnguyend192,t 10k gói to đó,0
_wyb.mtjj_,mắc hơn ngoài tiệm🥰,0
thuanduchoang34,t từ bé đến lớn mỗi lần về quê hay đi đâu mà gặp quán tạp hóa là phải tạt vô hỏi xem có nabati ko,0
kittydang.iu,có vị dâu rồi á,0
luy.ng210,100 gram là 1 gói à,0
trinhtran_phuonglinh24,chỗ t có 10k,0
voiuah28,vị phô mai ăn ghiền luôn ý,0
hoangminhdat0701,thương phạm thoại thì tim🙂,0
1234556677abc,tui van ko thay pham thoai gỡ nhan! nen nghi la tin này ko đúng sự thật quá,0
nhok63hust,team chưa bao giờ mua hàng phạm thoại 😂😂😂,0
user825203646,vừa lòng tao lắm chưa bao giờ mua hàng nó và ko bao giờ mua,0
user6163267453259,Lúc nó ủng hộ làm từ thiện thì mn khen. Giờ lại quay ra nói những lời khó nghe vậy,0
phm.th.kiu.lin5,ụa phải có gì mới dám đăng chứ đâu dám đăng khơi khơi vậy,0
chungoc9779,Đến giờ tôi vẫn k biét giới tính thật 🤣,0
ngoclan664,"khổ lắm ,đi từ thiện phải tội",0
nhinhnhoi,Tính ra cx tội . Giúp người h mất luôn sự nghiệp,0
linhchi050,Khoá nick tt luôn ui hả,0
tothimylinh3979,team thấy thoại live là lướt lẹ,0
thin.duyen0102,Thấy tội ổng vaiz,0
thanhthanhmakeupbacninh,"Lúc thì khen ng ta hết lời, lúc thì chửi ko thương tiếc, t sợ con người quá",0
nguyenthithanhnha..19,"Phạm thoại là ai,,???",0
mitxinhgai19,thương thằng bé ghê. hết chuyện này đến chuyện khác 😞,0
tranduongtrong,Phạm Thoại ❌. Phạm tội ✅,0
r37thamho,lúc bạn ấy bỏ tiền túi từ thiện ở làng nụ thì khen không hết lời.giờ bạn có chuyện quay ra vùi dập không thương tiếc sợ lòng người quá 🙂‍↕️,0
binhk588,Khổ thằng bé . Bị dìm hết lần này lần khác,0
baolong2026,phạt nhiều không thoại kêu gọi tự thiện phí phạt kkkk,0
chinhh2211202,Mặc áo độc lập tự do lun,0
giadinhcam2,Team chưa bao giờ mua hàng của phạm thoại a,0
phuockendy,phạt bao nhiêu??? sao không nói,0
user740665309,"thấy ông này tội nhất, giúp bà hoà bị chửi quá trời,giờ tới công chuyện nữa 🤣",0
ahghhbjhvg,Mới cbi comback thì lại bị 😂,0
phamvancanh3493,Tóm lại nó là anh hay chị?,0
user175997682,sướng nhất mẹ bắp không mất gì kiếm được mớ tiền,0
qui1.qui,Ôm đống tiền đó ở ẩn tới già cũng còn dư,0
testnguoiyeu_uytin_hp,Có ai thấy tội Phạm Thoại không ạ☺☺,0
kenihe4,phạm thoại kết hôn với mẹ bắp lụm mười mấy tỏi 😂,0
gia.pisico,"chẳng qua thấy bị bế nhiều quá , về ở ẩn thôi",0
huy83l,làm mấy trăm tỷ rồi.ăn sao hết,0
tommincun,khổ thân.em ơi bán hàng đi chị vẫn ủng hộ,0
tonyphamusa,Bán nhà luôn mới tin được bạn này,0
trangsuchongkongnemo,lại trò gì nữa,0
_anan89,thấy thương cậu này quá. đúng là miệng lưỡi thiên hạ còn ác hơn luật pháp vn .chúc e luôn mk và sớm có người đưa tay ra nâng đỡ e dần dần trở lại ánh,0
1245678minhminh,Giúp k đúng ng cũng là cái tội,0
shopgiadungthietbicamtay,Phạm thoại mọc đc râu kìa😂,0
user76639377384031,Gì từ thiện với mẹ bắp mà mất hết tất cả,0
phungthaibk97,Chắc tại chửi mn nhiều quá mất hết phước,0
quynhquynhcoca,Đang thanh tra mấy mõm nên là tránh thôi. Chứ đi tò nhiều quá r 😅,0
nguoi.ha.tinh38,"tạm thời ko hoạt động, còn khi hoạt động trở lại thì lại quẩy mạnh hơn nhiều lần",0
qnpt4,một lần giúp người sai mà hậu quả nhận lại.... chúc thoại sẽ có hướng đi mới tốt hơn,0
linh.xinh6068,96 nó thị phi lắm luôn ấy .,0
triker84,sợ đi tò thôi chứ tk nó tiền tỏi,0
quangdx248,"Tốt nhất nên như vậy. Nói đc thì nhớ làm đc, ko lại 3 hôm thấy mega livestream thì :))",0
huyloi38,giờ live toàn hàng giả giám gì live,0
mn_cng2,"Đôi khi mình gặp thời đang đi lên nhưng ko biết khiêm tốn, cứ nghĩ đang ở đỉnh cao xã hội đi chê bay đánh giá người này, xem thường người kia, và cái kết hậu quả đến nhanh lắm 😎😎😎",0
tuantufamily,Trốn ko đc đâu,0
ngdngg4,Thương a quá bao nhiêu tiền cho hết vào công ty giờ phá sản dẹp công ty 😭😭,0
user2827368641533,quả dân chủ 😂😂😂,0
n.g.u.y.e.t_27,quả dân chủ là j vậy,0
anhnguyet_2006,nhiều người thế chẳng lẽ nó nổ chúng mình,0
3010hk,"chắc gì nó nổ, mà có nổ chắc gì nó trúng mình, mà có trúng mình chắc gì chết.",0
c710701,ăn đc ko vậy,0
ilovetittochehe,ship sang dsq mĩ trả cho ngta đi,0
xiaoyun._0172,Tin chuẩn chưa sao hôm qua gọi về ko thấy mẹ kể gì 🫤,0
trxuanthinh_,Lúc nào đấy sao không biết nhỉ,0
e210358,mấy chục năm rồi nếu nổ nó đã nổ rồi😂,0
hacphng,sớm leg,0
discipline_is_freedom29,định luật chưa chắc :))),0
070973_,đông người xem vậy hỏng lẻ nó nổ trúng mình😅😅😅😅😅,0
bao.sir_,Nhanh chí đem ship lại cho chính chủ 😂😂,0
no.m.i.tn120,"Chắc gì nó nổ, nổ dễ gì trúng mình, trúng chắc gì chết, mà chết thì thôi",0
user378674699,quả dân chủ😂😂😂😂😂,0
trongphan013,"Ra gặp hỏi thì các cự lại bảo chú cứ giao cho bác, bác có kinh nghiệm cưa quả này rồi😆",0
mei_200209,ra trường r h ms bt trường có bom😂,0
chocopine_2006,tôi giám sát điểm này đây hôm đó tý hẹo,0
0x0067,"May quá, bn năm học mà nó k nổ",0
toionmakhsao,gần nhà ngoại mik,0
ve88beerclup1,Nhiều người vậy không lẽ tới mình 😂,0
user9222199685,trg t cm ạ:))),0
duy.hc.ting.c,😳 trường cũ tôi mà,0
brazerdathu1234,nó mà nổ chắc gì trường đã bay,0
levanphuc200.4,Tất cả đứng yên😂,0
tracyg461,That was so funny😂 who watched the video more than twice like me😁,0
hatinhminhthuong1996,tự nhiên xỉu ngang vậy trời 🤣🤣🤣🤣🤣,0
hauntedgamerwitch,stop using AI,0
oshagirl64,"So Cute, but it's AI🙁",0
debrahaych,it was at this moment he knew he f'd up 😂😂😂,0
phuongloanaus,Mang giải Oscar 2025 đến ngay cho taooo!! 😂😂,0
rolondaduncan1,He passed out still standing.....im dead🤣🤣🤣🤣,0
tabithajonesthoma,I'm alive I'm dead🤣🤣,0
mariabelenuf,El Rottweiler: pero si ni lo toque,0
patwhitefoot,🤣🤣🤣🤣 the puppy played dead,0
raimi.santos6,esta IA nos va a consumir,0
elvera.martinez,😂😂😂 Love it,0
duong_truong0,Coi như e chưa nói gì nha a Đen,0
bunniedunn,😳😂😂😂IS THIS REAL,0
tuncr70,một miếng thì thiếu mà 2 miếng thì thừa 😂😂,0
dennisdarby3,He gets an Oscar award,0
hollywood.smooth,He deserves an Oscar 🤣🤣🤣🤣🤣,0
ravanellyerick,This can only be AI; it can't be true.🤣🤣🤣😂😂😂,0
1msroyalty,That is freaking hilarious 😂😂😂😂😂😂😂😂😂😂,0
putra_batak4,apa cuman aku orang Indonesia 🇮🇩 disini ketawa ketiwi.. hahhahaha,0
nh.hng8005,vậy là sao 🤣,0
nguynthu1165,con nhỏ kiểu thoi tao chết trước cho chắc chứ đến lúc nó cắn là đau hơn chết,0
fashot1238,You all didn’t see the spirit bomb 😂😂😂,0
jayne_affiliate,funny dog😂😂😂😂,0
mr.caleb123_,bro nadie se dió cuenta que es AI💀,0
9nfyaq,khó cái gì dễ mà ai mà không đánh được,0
shinhuynin_76,Có ai wen vk 2 ôg nàyko. Nhờ hỏi dùmvkhos hay dễ,0
dabanhdenchet,ai hỏi,0
minhnhut9460,ai đánh đc trái này 😂,0
huy.huy9473,công nhận hảo Hán 😅,0
khoa.het.cuu,ý là ai hỏi á ?,0
tm.nguyn.th3937,khó nha bro,0
ocxe7497,thế bi khó thật,0
5880kay,t tay trái dễ,0
khang13042010,khó 😂😂😂,0
nguyentaii1994,Phải tôi cũng chịu,0
noinho_993,Khó thật,0
vardawn08_,Tôi thấy chỉ cần hết tay hết lực là được 😂,0
user085362650,bỏ tiền nhiều ra là đánh dc,0
tuna.sgp,lỗ đã xa bi thì để dưới sao đánh đc,0
v.thng8386,được lô này mất lô kia,0
nguyenvutrong060812,Khó đấy,0
votienquoc0998,Khó quá bỏ qua đi,0
hong.long8016,khó thiệt,0
nguyen.caoduy,vì mục tiêu ở bàn bên kia 😂😂 nên khó là đúng 😂😂,0
quanglym,hình như cơ bàn libre hả,0
mari.ozawa.di,đàn ông thì khó... những đối vs phụ nữ thì quá dễ kk,0
minh.khang.v5,khê lắm em ơi 😁😁,0
tuan6678,Tôi từ Bắc vào nam chơi bida. Kg đối thủ. Phải công nhận quả trượt là trắc 😂😂,0
maidanganh678,khó thật,0
ynn5991,Ơ sao mn chê dữ vậy t thấy bả đẹp mà nhỉ,0
20052004vv,sau này mà có tiêm lại hocmon nữ có trở lại nguyên trạng như xưa k ạ,0
user4068301747306,Ngày càng y chang con trai bây ơ,0
minh.nguyt822,Mk t thấy bả đẹp trai hả🤗,0
ledoan.hung,Ai có link áo ptr đang mang ko cho mình với ạ,0
nganvy5,Phương trinh mà chê thì hong biết khen ai luôn à,0
xun.ttn.11,giật cả mình,0
hlihp,mình rất thích con gái mà mạnh mẽ như thế,0
qyn.ah_08,Đẹp ác 😭,0
catim55,Uổng quá 🥺,0
ltkimchi1010,Đẹp traiii quá đi:)),0
user8472761015399,Nhìn càng ngày càng giống thanh duy,0
bn.u.chm.mm.tm.mi,vượt mức pickeball r á tr,0
loc.cao51,thich minh quang keu kia e..,0
dvdlxuanmai,Hình như e này đống phim Kính Vạn Hoa pk ?,0
yenphungcb82,giống sơn tùng vậy,0
zun_045,Mê vẻ đẹp này quáaaa 🙈,0
user783599719,Con gai đep hon,0
lvnh0608,Trả lại PT ngày xưa đây,0
khoandiep,Giống son tùng lắm luôn,0
khongten3245542,ê tính ra cái video ngkh đăng lợi còn k flop bằng 9 chủ🗿,0
chunganh971,"Khứa quần xanh phong cách rất hào sảng , quân tử",0
chu.c.kin83,duy nhất trận này chơi cực đẹp luôn,0
abfofficialchannel,Mình ko biết nên muốn hỏi tại sao lại đá cao như vậy mà ko tập trung đá ở giữa hoặc thấp hơn,0
sa.mc50,Nó quét trên trước sao không quét trụ nó mà quét trên lại ta,0
hong.minh4286,trúng cái hạ màn luôn 😁😁😁,0
nhamphanquang,"Chẳng ai thua cả , cả 2 đều thắng trong lòng ng hâm mộ ❤",0
vo_thanh_danh,trận này 2 ông hay hết,0
buivietanh1012,Đây là cú đá lái dó à😅,0
tranduong9094,"đánh tinh thần võ cao, thắng thua cũng cười😂😂😂",0
khoa.chu6589,2 đối thủ này tôn trọng nhau.,0
na.shop934,tinh thần võ đạo,0
topstpc,sao tôi thấy quả đập tay đẹp v,0
laotatudao,tinh thần thượng võ là đây,0
rathuitz_aza,vẻ đẹp thể thao thật sự,0
mega.film70,team này là đánh đẹp nhất trong nhiều trận mình xem,0
t622337,có lối chơi đẹp,0
lenhhoxung9301,Đẹp vãi 😝😝😝😝,0
thinnguyn858,2 ah quá hay..,0
dhdbdbsns,Khứa quần xanh nhanh thiệt chứ .😳,0
nguyenebnguyen,trận này t cực thích,0
daishinkan.1999,2 quân này quân tử thực sự,0
tritoaiamnhac,Đẹp 👍,0
thayhuutinhoc,Đồng ý là khô máu nhưng vẫn tinh thần võ đạo và thể thao. K như 1 số tay chỉ mong ăn hôi,0
user2557836406966,vui lắm à,0
cm.viet2,ném tay trái mà kh trượt😂,0
cuoidaubai23,Đép chuẩn vậy😂,0
dmanh_25th5,fan hoàng emm kia lớn,0
k10gayloljbt,ko nên như v,0
1mnr38,Nhưng họ là người già ko nên :)),0
2k8.son,Tưởng thế là vui,0
anyhaz3_qa,đi iar ở đâu😭😭🥰,0
kofaiboiphomalakidloff,36 tuổi?:),0
vinh.quang195,Ở đâu v troi,0
dy.b.lm.giu.tipcl,ở đâu cũng đc miễn là cùng nhau🥰,0
tranhalinhtiktok,bao nhiêu tuổi 🤨,0
dinhhung2106,Đội vội 2 tiến sỹ này fan ruột MU,0
maianhbaomebet,Căn phòng nhỏ hạnh phúc to 🥰,0
bpheem,Một túp lều tranh hai quả tim vàng ❤❤,0
ductrungtoyota,Gặp ngày mưa ẩm như việt nam thì khóc mẹ nó thét,0
khangmap13,hội chứng thích bị hẹp 😂,0
au88857,Niềm vui nho nhỏ:)),0
hngia4441,đúng câu "một túp lều tranh hao trái tim vàng"☺️,0
appleuser53832502,Đỡ mất công dọn nhà á,0
user6233458877366,Bao nhiêu mới là đủ cảm thấy mình đủ là được hạnh phúc là được,0
clinhdannn,người giỏi có mấy ai bth đâu🥰,0
minhz03,có lẽ toii ko phải là tiến sĩ nên t ko hiểu đ😅,0
tuyn.nhn.s0,Người giàu là như vậy hả,0
hikari.hanzai,tiến sĩ🤡,0
miqtrund,khét vậy trời😅,0
l.meb.et,Hạnh phúc khi ở bên cạnh nhau làm những điều mình thích,0
canlinh0,thì chắc vỡ nợ,0
nguyenbaokhang510,xây rất nhanh mà ra đi cũng nhanh :)),0
hoaiphuc2401v,vn thì vậy thôi😌,0
o.ma.chi_,r đứa nào tìm mãng cầu siêu to khổng lồ vay 🥰,0
...................haloo,Chuyến này mấy anh thầu đi hơi xa,0
mrdanh2023,"xây ra tốn bnhiu tiều,lãng phí quá",0
ngxuantruong_2012,Chắc tốn phải mấy chục tỷ,0
khi...thich...ngu,đớp quá mà,0
ngugia779,Do sạt lở đất thôi,0
soigiahuhong,nhìn cầu mỏng manh v s dám đi=),0
loyinogay,Hồng tỷ =)))),0
ta1soda,Cầu gì cơ?,0
v.hng.ve88,Mới học tới lớp 3 mà đi làm thiết kế công trình rồi 😂,0
quocloi.99,hàng tàu nó vậy đó,0
quang29111998,đớp hơi giày thì chả sụp,0
l_climb_day_nek_29,cầu j cơ,0
viet7612,này do đia chất,0
thanhtuan170802,nhìu tk vẫn bợ tàu 🤣,0
chinv438,hàng trung mà,0
user65266305220097,cầu này ko đặc,0
vanco2010204,Rồi sau mãng cầu siêu to khổng lồ ủa,0
hdhhxkmxv,muôn xin tên nhạc,0
5th12_05,Thấy kh chắc chắn lắm,0
phuc...62,trời ơi xong chua tới chú chờ nãy gio😂😂😂😂,0
minhhy426,Con tui y chang và sau 2 tháng thì mẹ dính dưởng 😢,0
23082018tram,Mới cai được hơn tuần cảm thấy hụt hẫng,0
huongphamphamhuong,"Ko, t nuôi 2 đứa đều ti mẹ, khi ti là nghiêm túc ti, chứ ko có chuyện quắn quéo như này, với cũng ko có chuyện ti 1 bên còn bên kua đưa tay nghịch🙂",0
haianh1995,Bé nhà mk cũng vậy,0
nhatruong030902,Trời tưởng gì làm miết,0
thobe210195,"Y chang con t, nó kéo đau qá chừng 😂",0
khungvongchatluongcao,Sao con giống chú quá vậy 😂😂,0
thanh.l2330,ý chang con t ln😂,0
phuquocnguyen672,thấy chưa chỉ có mấy ông bố chúng tôi mới biết nhẹ nhàng nâng niu thôi 🤣🤣🤣,0
m.em286,bà có bị cắn chưa tui bị cắn ra máu luôn,0
haudz16,Bố còn nghịch hơn,0
ngot74,Sau nay lớn cung nhièu trò đây,0
23nhunguyen,y chang con tui kkk,0
duongnrbk,thằng nhà mk cũng vậy dùng như phá xem nó ti mà nhõi lòng 😂,0
newspapervang,giống bá nó thế,0
hoahong674,Con e bh cx bẹo hình giống v đó chuy kk,0
bedutisme,Y chang con nhà tui🗿,0
mbapbe600,"có gì đâu mà hụt hẫng,cai có ba nó thế",0
hong39375,Giữ gìn cho bố với cháu ơi,0
minhhuyen10040,Rất quen nha 😂😂,0
trang.thanh1622,"cáI trò chơi j mà từ e bé, thanh niên tới già tóc bạc luôn ai cũng thik hết z ta ngộ ghê",0
duyn.phng37,vừa xem bên mnhyokay luôn,0
hanhannve88,Giờ đàn ông ai cũng v à 😞🙏,0
au88590,tim 1s có nha,0
bnh.yn0003,làm v coi được hả ông nội😁,0
phamvuong159,Con gái tui sẽ học võ từ nhỏ,0
baxacuathanhnam,Xem bên mnhyokay mà không ngờ luôn 🤣🥳,0
au88choilaghien,"bị đụng chạm là phải la to lên, đừng có sợ bị kỳ thị các b à",0
trn.li8958,khứa này xem phim nhật quá 180p à,0
mikmuoncony1,Vừa xem bên mnhyokay có cái nhìn khác về em luôn,0
thunhuan8,Vừa xem bên mnhyokay luôn 🥳🥳,0
linhwinter_0403,"bị đụng chạm là phải la to lên, đừng có sợ bị kỳ thị",0
ich.bin.lee0,Đợt t đi từ Sài Gòn ra Hải Phòng xe giường nằm cũng có thằng có ý dở trò. T chửi ầm xe lên,0
bimat.feb.et,gia đình có nghề làm thầy thầy cúng không???,0
b.con.meb.t,Tâm linh ko đùa dc đâu,0
au88857,Hệ thống bắt làm vậy để trường thọ,0
adpebc,Ko rep mai xui cả ngày🍀,0
au88590,sao ghê v trời,0
lcp1102,thầy cúng đại chiến 🤡,0
vinh.quang195,Sao lại v đc nhờ,0
trthinhh28,nhiệm vụ hệ thống,0
bo829,Sớm 🥰,0
l.meb.et,"Không nói trước được điều gì tâm linh phải tin, nhưng sức khỏe mới là quận trọng",0
hano1v99,Có năng khiếu pháp sư từ nhỏ,0
theanh.1234hi,trung bình t hồi nhỏ muốn gây sự chú ý :,0
anhyeuem.v1,Xả xui cực mạnh,0
quocdat.0606,Đầu ạ,0
68gb.chat,nói gì nói tâm linh k thể đùa dỡn đc,0
bunoc.kclub,Thầy nào thì cx phải học chữ đã 🤣,0
user667985756,nhìn là biết có kiếp có số,0
lenhathoang27_2_2011,nhanh nè shop,0
abandonedhuman,+1 câu chuyện cho chú ba duy,0
mothetindung_0787292929,"Nếu người lớn thì bảo mê tín dị đoan,nhưng đây trẻ con thì nó làm sao biết dối đc nhỉ",0
tuyn.nhn.s0,tâm linh kh đùa dc đâu,0
hngia4441,tâm linh ko đùa được đâu🍀🍀,0
nglong15thg12,99% trẻ em chọn chocopiece thay vì custas,0
meme.hi.ba0,khi t ăn custas cốm,0
tata.zie,"tết đến còn có vị dưa hấu, đào quý vị ạ =))) hôm nọ còn thấy page nào nó đăng năm nay có vị nho nữa 😂",0
tdatt94,Ngán kinh,0
dng680505,y hệt luôn :)))),0
thanhluong157902,bro fan T1 à +)),0
kh.robolox,ko ai thấy cái ghế à 😭😭😭,0
nome.50,ơ cốm đâu,0
quanghuy10181,ô nhiều sao thế:)🤔🤔🤔,0
roadtonba171,Custas xưa cứ như đối thủ chocopie ấy,0
dangui_giang,tui thích hết vị của bánh trứng custas😆,0
chimtoo7,"lớn lên là khi bạn nhận ra Custas ngon hơn Chocopie trong hầu hết các ngày, kể cả tết",0
luvusmshuu,vị mâm xôi việt quất peak vl mấy con gà bíc gì,0
j0o4fuckq_,i don't like custas😭,0
uiak413,có mấy cái sao sau lưng kìa,0
deptraidaixe_,custas giảm đường rất ngon,0
plogz08,Ko hiểu nên mới hỏi. Tại sao bánh itd đường lại đắt hơn mấy vị còn lại nhỉ? Về lý thuyết thì giảm đường nghĩa là giảm nguyên liệu -> giá phải hạ xuống chứ ? Trong khi đó các vị khác giá cả làm sẽ chênh lệch một chút nhưng giá thành sản phẩm sau khi làm ra lại giống nhau?,0
shiromujo,mình thích custas hơn chocopai,0
sugerdaddy_2le9,nó khô nó thô nó tốn nước,0
ngliungliu,bánh cớt tát:)),0
bantumlum9991,Cái nào cx 67k,0
winter_is_cominggg,xây nhà cho mình ở mà bị người dưng chỉ trích 🤭🤭🤭🤭,0
ch.thin9922,lỡ có con nhỏ nó đi r sao,0
user48779881779,sở thích mỗi người mỗi khác mà trời ơi tôi cũng thích cầu thang kiểu đó đó 😌😀,0
dk52100,Ngày đó sẽ đến,0
tanvu268,"Dân mạng hài thật, nó hay người nhà nó ngã thì kệ ngta, miễn sao nó ko khuyên mn làm theo là dc😆",0
hauphuong093,tao thấy bth nhà ngta thì kệ ngt,0
aquarius67896,"Nhìn cái cầu thang thôi mà thấy sợ luôn, chắc do t hay chóng mặt 😂😂😂",0
yuu.wuji,nhà ngta liên quan j m?😞,0
tranminhtuan214,đới bố bố quản🗿,0
tumapu,đi bt thì ko sao nhưng chuyện xui rủi thì nó vô chừng lắm. nhiều khi đang đi mà mắc sn chuyện gì đó cái bước hụt chân thì..,0
thch.n.nem.va_b.et,Nhưng mà đó là nhà của người ta mà,0
linhan.1309,Nhà t cũng k làm lan can . từ ngày bé hai ae t vẫn đuổi nhau trên cái cầu tháng ấy . Sống lâu dần n quen ấy. Đến bây giờ sau hơn 20năm bố mẹ t mới làm lan can á . 😆,0
chengheng_9102010,sớm 🥰,0
shizukavietnam1,Nhà thì thuê nên tiết kiệm làm đúng là tốt mà,0
dangsam95,làm t nghĩ đến ông Duy,0
trung.thnh.nguyn636,tôi xây nhà 16 năm nay ko làm lan kan,0
trn.li8958,nhà ngta ngta xây thế nào thì kệ ngta,0
nhi.i536,"Nhà tớ cũng xây cầu thang ko lang cang , thấy đẹp và thoáng mà",0
tien_art_92,Ngôi nhà đi đến thiên đường 😂😂😂,0
wheymass_thainguyen,Mấy bạn thử xây nhà r biết 😂😂 mình thấy có tốt có ko tốt,0
letrinhyeubin1,nhà ngt sống sao kệ họ,0
thaonguyenstoretpt,Tô chưa mn. Nhìn như nhà hoang vậy,0
luckyandkid,Bà này phốt quá chời,0
zitkhogungsa,"kệ đi thiết kế có tiêu chuẩn an toàn riêng, tại sao bạn lại mong 1 huấn luyện viên biết điều đó.",0
mrvuive2023,Truyền tải thứ không đâu!,0
lamgiaucungve88,Quá rẻ để cứu một mạng người 💕,0
trumsoclovn4,lúc mà nó ra là ba t mất r=((,0
1105nmt2003,quan trọng để hết ung thư phải cần bao nhiêu lọ?,0
l.nam6239,chữa hay chống,0
panhsicalosicalo,Lần đầu thấy 20 củ cũng rẻ🥰,0
anhgg467,Ungthu giai đoạn cuối có cứu đc ko🥺,0
truongbatpham0,năm tr mẹ t 44🤣,0
trannguyenreationpower,người nghèo làm sao mua nổi để trị😢😢😢,0
quyt.hong.ngot.ol,Cho hỏi ung thư máu chữa đc ko,0
ducthuanzss,bệnh one shot nên đắt🥀,0
anhduc87979,20tr/1 lọ trị 10-12 lần tức là 10-12 lọ ạ ?,0
user2vv7e9i009,nó chỉ tăng th gian sốg th đko?,0
thangcachep1122,Đối với 1 mạng thì 20 quá rẻ,0
quansaine,"960,000 triệu cho 1 người",0
hieu1162007,Chỗ thì 18 chỗ thì 20 là seo ta,0
hoanglog2008,rẻ dữ😍,0
ngocmai6027,cũn giẻ đós,0
emyeuanhtoann,rẻ dị ra trc 4nam thi ba t còn roàii,0
nguoilajok,20 nhân 2 nhân 24 gần 1 tỉ cho 1 mạng người,0
ca.phe.sua07,Ai làm phiền em đi,0
bunrieu530,thư viện pháp luật 18tr beat đỏ 20tr😂,0
cuthethoi_2311,"chỉ giúp đq cho những người giàu có tiền thôi
20tr thì hơi khó đối với những người có hoàn cảnh khó khăn",0
anhshipperva_b.et,rồi nghèo như t lấy tiền đâu mà tim ?,0
hainb9900,Phổi giai đoạn cuối đc không nhỉ,0
snghnghong6,Nói tóm lại chị hay là anh đây.,0
thanhnqan_1512,nhìn ấm dâu s ấ,0
nguyenthingocmai92,Ý là sao cứ phải nhếch mép nhếch môi nhỉ,0
thaihaa204,Nhìn sợ quá 😭,0
pipo161297,Gì mà thật hạnh phúc và mai mắn Hoài vậy 😒😒,0
bnh.nguyn.th8183,tiết cho một đời người con gái,0
ngocvu256_,chào chàng gái,0
siucapxam,"anh thì chưa tới, chị thì hơi quá☺️",0
mtto3538,con người khi càng thay đổi càng tỏ ra mạhj mẽ thì là luc ngta cnagf yếu đuối,0
ruraanna,Làm người ta fai yêu thương lẫn nhau. Mà e thấy hơi sợ sợ ý❤️,0
monmi482,chả za kiểu j,0
c3.70ty.ninh.1994,ghê ghê s á,0
khotreuvocung_212,Là aiii? Là ai khiến pà trở thành ng nv😢,0
fuuki.yuduru,"Cái hàm là tiêm filler hả mn, t đang tính đi tiêm cái hàm cho nó men lên chứ tập nhai hoài lâu lên quá",0
pompom.ng,bả có thần thái á,0
ng.thu.kim.ngn123,rep em ik cj,0
gu.wonyoung,ê mà nhìn cái mũi thích thật😭💔,0
tragchuchekk,Môi mỏng thì giống,0
bn_208,Đẹp lắm chàng gái ❤️,0
tieu_anh_yeu_yuzuru,em đầu tiên,0
thanhtrung.2509,làm chuyện tốt cũng bị nói sợ lòng người thật,0
bnh.xo862,vui lắm ạ,0
si.lc.by88,làm màu,0
ctnhl1,trời cúp điện biết máy phát điện có giá trị như nào k mà mấy th nằm bấm đt nói lắm vậy ?,0
anh_2010_27_2,ảnh dễ thương lắm nha 😍😋,0
tokimnhieu20,"Mắc mệt, đang cố tẩy trắng àk🤣",0
xiiconngi,Có làm tốt vẫn k chịu nuôi con vợ ai mà tha,0
bi.bi.feb.et,anh jack là người tốt,0
andrewartist2,"Bình thường không thấy làm từ thiện đâu, bị cấm cái là giả nhân giả nghĩa 😏",0
dhm31012011,chồng t đó trời nhìn mà tự hào ghia á -)),0
nhtaddd63,lại tiếp tục cố gắng tẩy trắng cho mih😭😭,0
tysaurienghanoi,làm màu 🤣🤣🤣,0
caucan0246,làm việc tốt thì k ai khen k thấy ai nói. lỡ làm sai 1 lần bu dô to6 nói này nói kia 🙏🙏 sợ,0
le.huong_1,Từ thiện như jack nè k cần kêu gọi ai cả,0
b.tao13,"Ủa sao cải tạo 9 tháng mà đc ra đường v m.n, mà thôi cố gắng cải tạo tốt sớm về với m.n,và hoà nhập với lại cộng đồng..",0
vanduc1310206,Đánh phấn à mà mặt trắng v,0
nguynvnminh76,hát 1 bài bằng chúng nó đi làm một kiếp vậy cũng vui,0
dex0988e,đốm còn kiểu: mày làm đc ko,0
elpulga_fcb_luyt,Có lên jack. anh xứng đáng là cái bóng của Sơn Tùng M-TP. và đom đóm là cái bóng của sky 😂,0
depzainenanhkhongsai,Anh ơi nuôi con xog chưa vậy😇😇,0
.tranchinam1408,Thực ra chỉ là đánh bóng tên tuổi thôi,0
duckulu,quay xong hết dọn liền,0
tgiang_....0,"k hỗ trợ thì bảo "" thấy dân như v k bt giúp ""
hỗ trợ r thì bảo làm màu🙃",0
anan.364,Mà cũng lạ nhỉ sao đi đám cưới mà ko mừng ngta,0
6901ngoc,Đúng mà có nợ thì phải trả,0
quynh77014,"Có mời , không đi , không mừng . Xin stk nhưng rồi im ru 😆",0
02072002huyy,"Có đi có lại thôi , chuyện đó là bthg",0
gaichuavo2,"hơn 4 tháng giờ mới đòi,chắc hết tiền tiêu hả🤣🤣🤣🤣🤣🤣🤣",0
