clean_text,label_name_true,label_name_pred
coin card : 3,Clean,Hate
cái gì thế : ) ),Clean,Offensive
"lý khùng thì , kk",Hate,Offensive
à thì ra người nhật cũng chẳng hợn võ hồng_tâm,Clean,Offensive
được đấy abe,Clean,Hate
"đề_nghị 17 , 22,23,32 đến phà vài hơi vào mẹt tk này để nó đi cách_ly thế_giới hẳn đi .",Clean,Hate
alex dương thiệt luôn 😤,Clean,Hate
"không nói thì tự_kiêu , nói thì lại tự_ái chứ í thức thế ai mà chịu nổi 😡",Clean,Hate
chán thực_sự = ),Offensive,Hate
hanh viet hết cái bọn cực_kì thuyết_phục bây_giờ lại đến bọn : “ ở nhà giúp mẹ giúp cha . “ xàm lol như nhau cả thôi,Hate,Clean
sói said : “ daddy finger where are you ? ” “ here i am ! “ = ) ),Clean,Hate
buồn_cười,Offensive,Clean
ai hiểu lắm anh dạ nói em nghe em nói với người đó giùm,Clean,Hate
"chi bà nhiều tiền thì đi làm từ_thiện , còn ơ đó nói_tục tiểu , giơ bẩn . làm_nhục người vn trên thế_giới . làm bai hoại nền văn_hóa vn . xin yêu các cấp thẩm_quyền vào_cuộc sử lý .",Clean,Offensive
éo thích thì biến đi thọc con mắt chóng cái tai lên xem làm ghì,Offensive,Hate
hữu nghĩa cánh hoa : >,Clean,Hate
cây_bút đẹp vl,Clean,Hate
trước_sau gì cũng đi theo phúc xạo lol,Clean,Offensive
nặc na tao cũng không bình thường nữa 😁,Offensive,Hate
đọc rất diễn_cảm 10 điểm về chỗ,Clean,Hate
bán hàng rẻ không thơm lâu thì nói không thơm lâu . nói hàng fake . mắc gì quảng_bá làm như tốt lắm .,Clean,Offensive
cực_kỳ thuyết_phục 🙂,Clean,Hate
nhìn mặt bà này .,Clean,Hate
chửi đáo_để thật !,Clean,Hate
đệ anh độ toàn sống về đêm,Offensive,Clean
minh hoàng nuôi cá trồng rau rồi ai live xem 😂 😂,Offensive,Hate
sống chậm thôi !,Clean,Hate
"với những trường_hợp trốn cách_ly cứ phạt tù nặng mới sợ , đùa sức_khoẻ bản_thân rồi chẳng may lây_lan ra ngoài lúc đó xin_lỗi cũng chả ai chấp_nhận đâu",Clean,Offensive
lờ ô lờ ôn lờ ôn lôn huyền chim : ) ),Offensive,Hate
con bóng ? ?,Offensive,Hate
"mình đừng nói xạo nói_láo nv chị không thích z , vì chị chúa nói xạo rồi",Offensive,Clean
trai hay gái ?,Hate,Clean
bàn_tay em đẹp quá . nhìn chị đàn_bà mà xấu quá . .,Clean,Hate
"nó học cách thằng anh nó đó , hèn , khốn_nạn",Clean,Hate
cái mặt con bò biểu_cảm_vãi haha . đhs tự_nhiên thèm thịt bò khô,Clean,Offensive
cô nói_chuyện cưng quá à,Hate,Clean
giờ nhìn sang quá .,Clean,Offensive
like 10 năm chất liek bằng đầu bùi,Clean,Hate
giờ linda chững_chạc hơn hồi trước rồi . 😍,Clean,Hate
không csgt nào tốt cả .,Hate,Clean
như lol anh ba,Offensive,Clean
việt nam_vô_địch . ( tối_ngày 10 / 12 / 2019 ) cầu bến_thủy - vinh na,Clean,Hate
kim thoa lưu mốt gặp nhau thay_vì bắt_tay ôm nhau thì tao sẽ tạo_hình cánh hoa tặng mày : ),Clean,Offensive
ủa tao người tương_lai à 🙂,Clean,Offensive
cà_khịa anh tôi nhanh : vậy,Hate,Clean
hình_ảnh quốc_gia . . vn thì không cần quảng_bá rồi .,Clean,Hate
"con bóng đực kia cũng dạng đầu trâu mặt ngựa , 2 mặt , nịnh_bợ .",Clean,Offensive
trần sang ổ con cặc,Clean,Offensive
đọc xuyên câu không suy_nghĩ thử xem . . rất ngộ_nghĩnh 😳 💕,Clean,Hate
tết vẫn ngon mặc_dù không thịt hợn,Clean,Hate
họ nhìn con này sao họ mới gọi nói như vậy người không giá_trị,Clean,Hate
hời đất cơi cô đẹp quá cô ơi,Offensive,Hate
không nghìn nào giúp dân thì nín đi !,Clean,Offensive
"dân không giàu nhé , chỉ nó nước mạnh thôi .",Clean,Hate
cô ba dẹp gái qua ha 🤩 🥰,Offensive,Hate
muốn đẻ đứa như tùng sói vậy á 😆 ❤ ❤,Offensive,Hate
hâhhaahhaah,Clean,Offensive
mvp việt nam đấy : ) ),Offensive,Clean
đêm đói ngồi xem anh độ ăn mà cồn_cào hết bụng : (,Clean,Hate
thiên_anh,Clean,Hate
nguc em hoi nho,Clean,Hate
nguyễn thị linh_chi văn thắng về đi 2 bạn : ) ),Clean,Hate
cám_ơn thầy ạ,Offensive,Clean
"anh tiệp chất quá khác hẳn lúc viện , hơi xập xệ : )",Hate,Clean
ai đó trả_lời vs tao đây e gái thầy ak ?,Clean,Offensive
kinh đấy,Offensive,Clean
mày à tao không còn ngon ngữ nào mà chửi mày nữa,Clean,Hate
nghệ_sỹ hài hải ngoại được nhiều bạn trẻ nước mếm mộ nhất,Hate,Offensive
rãnh đít đây .,Hate,Clean
anh nguyễn khóc 8 chục dòng sông 😭 😭,Clean,Offensive
cái mỏ i chang cá_lóc lun,Clean,Hate
rất ủng_hộ page nhật_ký yêu nước . .,Clean,Hate
"em sẽ hay học hơn nếu lớp những bạn nam khoẻ , dai_sức , . : 3",Offensive,Clean
a độ dạo này đăng miết thế 😅,Clean,Hate
không live hả anh : ( (,Clean,Hate
thèm bún real vl : ) ),Clean,Hate
@ lucky lucky sao bạn bình thường bạn nghe mik ns coi,Clean,Hate
chụp cái góc từ chân lên phải hơn không 😞,Offensive,Hate
khổ nông_dân quá .,Hate,Clean
"ở minh bi được vao vien khám , con ở bọn nc thấy bao_la phat triẻn thi ve_nha tự cách_ly",Clean,Offensive
thích quảng_cáo không : ),Clean,Hate
ae kiếp này không kiếp sau ae ạ,Clean,Offensive
nơi nào mà cũng được như thế thì có_lý_do gì mà con đân việt nam phải sang nước_ngoài sống .,Hate,Offensive
cô người miền tây hả cô,Clean,Hate
qua học_trình_độ chặt cây mà không bị dân chửi trung quốc .,Clean,Hate
"chống mũi bao , nhiêu vậy",Clean,Hate
"khánh hồng nguyễn thiều my nguyễn hà duy đăng \ "" đợi đấy \ "" : )",Clean,Offensive
"mn tải ứng_dụng kiếm thẻ đt nạp nè . ngày ít cũng được 2 cái card 20k đấy . link tải chplay nên không sợ virus , tôi chăm online nên ngày nào cũng được cái card 50k ít . cài xong vào mn nhập mã chia_sẻ nhận điểm",Offensive,Hate
tuan tran quoc có_thể chứ . vn mad,Clean,Hate
đúng chửi,Clean,Hate
chán_thế,Clean,Offensive
! : 3,Clean,Offensive
dan ha loi ngon roi .,Clean,Hate
"cs miệng đít chúng một chỗ . một chế_độ thổ_tả không còn sửa_sai được nữa , mà phải thay_đổi với một chế_độ khác . sống với cs mà không biết gì về thủ_đoạn bọn chúng không cái đầu .",Clean,Hate
làm đồ vỡ tí cũng up fb sen làm lố quá nha_h,Clean,Offensive
ok anh ơi,Clean,Hate
minh hiếu nói chốt đơn chốt đơn do cj minh hiếu nói phong long mà chứ đâu nói cj trần đoàn đâu ? ?,Offensive,Clean
thầy bình_luận thêm điệu cười đáng yêu thầy nữa vào : ) ),Offensive,Hate
thầy tao đó,Hate,Clean
mình không đồng í vs bạn trung,Clean,Hate
éc nghe nói ai tiếp_xúc với 2 người tây đều cách_ly mak . sao giờ lộ ra nv siêu_thị điện_máy xanh vậy trời . lơ_là rồi 🙈,Hate,Clean
ae thất_lạc abe ak,Clean,Offensive
co tien dug nen khoe nha_ma co ngay troi không do dau co ngay_di_an majk nha_má,Offensive,Hate
ai theo đạo râu xồm thì giơ tay ? hãy theo minh giáo_chủ sẽ được lên thiên_đường xhcn !,Hate,Offensive
chi de thương,Hate,Clean
"ae thấy hay thì xin 1 đăng_ký kênh ạ , cảm_ơn",Clean,Offensive
vẫn không chừa được những lời_nói thô_tục,Clean,Hate
cái áo sọc mặc hoài vậy thầy,Clean,Offensive
huy quang ghê nhờ 🙂,Clean,Offensive
dân lo mà sợ gì chơi tới đi mấy bác,Clean,Offensive
co . hieu . oi . hoang . canh . con . kho . khan . qua . co . oi . giup . con . voi . co . oi . con . noi . thuc . su . la . nha . con . khong . co . gao . an . luon . do . co . oi . con . noi . thiet . la . nha . con . khong . biet . chung . nao . xap . nua . do . co . co . long . hao . tam . co . giup . con . voi . co . oi . co . hieu . oi . sdt . cua . con . ne . co . oi . 0369546059 . do . co . con . o . ap3xatanhoitrunghuyencaolanhtinhdongthap . do . co . con . noi . thiet . do . co . oi . giup . gium . con . voi . con . kho . wa . co . oi,Clean,Hate
tủnn tủnn đú vô cùng luôn = ) ),Hate,Offensive
from mixi with love ❤ ️,Clean,Hate
anh yêu em thắm ơi,Clean,Hate
ca_sĩ cây atm,Hate,Clean
cái miệng rộng qua đẻ con ra còn lọt,Hate,Clean
"chị_em nào “ đến tháng ” mà đau bụng dữ_dội , đau trời long đất lở , đau héo_mòn thân_xác . ib em để hết đau mãi_mãi luôn nhé . 💕 💕",Hate,Offensive
nguyễnn giangg yep,Clean,Hate
"ý_thức người văn_minh khác , cao chót_vót đéo với nổi .",Offensive,Clean
lại bảo sai đi : ) ),Clean,Offensive
túm lại : muốn giết người mà vẫn vô_tội hoặc án gãi ghẻ thì phấn_đấu làm cán_bộ đi .,Hate,Clean
. trung dần,Hate,Clean
quang hung vu bên đấy bảo cách_ly tại nhà bệnh tự khỏi = ),Hate,Offensive
nghe cực_kì thuyết_phục : ) ),Offensive,Hate
chuẩn cmnl anh ơi,Clean,Offensive
phát thịnh thầy tui như thằng xì_ke .,Offensive,Clean
gai tre,Clean,Offensive
"nam đặng đời nó thế , lồn mẹ dell thấy cái lồn gì vui cả",Hate,Clean
ẩu r thầy ơi,Clean,Offensive
may bede ma rau thay on,Offensive,Hate
mis nhung,Clean,Hate
ok thầy nhoa ❤,Clean,Hate
chửi hay ghê_k,Clean,Hate
tin tin nên về làm taxi nhe đồng_chí .,Clean,Offensive
danh_hài abe,Clean,Hate
thấy thầy ăn_nói lịch_sự như này em không quen lắm 😑 😑,Hate,Offensive
mình nói người_ta bê đê mình xem lai mình đi . mày la cũng loai bê đê co cây đinh chính giữ la may không,Clean,Hate
abe chơi dơ,Clean,Offensive
"duy nguyen ảnh này mặt rữ quá 😌 , cười cà_khịa ms vui",Clean,Hate
chí bảo tên tôi ông eii cảm_giác như mình tội đồ haha,Clean,Hate
câu_chuyện dài,Hate,Clean
hà boo diễn hôm 4 - 5 / 1 chị ạ . từ sau không đi_nữa .,Clean,Hate
lê quỳnh anh mỗi nước 1 quan_điểm sống . chê bọn tây làm gì haha .,Offensive,Hate
hoang pham cưới vợ đi,Clean,Hate
"thật_sự trận hôm_nay team không làm fan hâm_mộ cảm_thấy dễ_chịu một_chút nào cả nhưng em vẫn đặt niềm tin vào đây nhé , nhận cọc thì mai phải cố hết_sức nhé 😊",Clean,Hate
nguyễn việt hehehe !,Clean,Hate
vụ linda thì sao vậy thầy,Clean,Hate
❤ ️ refund ❤ ️,Offensive,Clean
nhà em hộ nghèo được ưu_tiên không ạ 😞,Offensive,Clean
chị minh hiếu dễ_thương quá trời,Offensive,Hate
cẩn_thận con thắm nó chưi : ),Clean,Hate
hỏi xem mấy trận này ở đâu vậy ae ?,Clean,Offensive
lê nhật trâm đi máy_bay riêng đó hả,Offensive,Clean
mấy đứa antifan lại bảo anh tao ghép ảnh đi 😌,Clean,Offensive
tiên_tri trần dần về việt nam ở nghĩa_trang bình_an,Hate,Clean
lặng,Clean,Hate
tr thanh tùngg gái ở đâu ra cơ,Offensive,Hate
tối nay sờ trim không anh độ,Clean,Hate
mới vào nghe bã chửi banh nhà_lồng chợ luôn vãi thật,Hate,Clean
gian hồ đài loan đầu sao mà kg lên tiến,Hate,Offensive
không_khí đạt chất_lượng như hôm_nay cũng nhờ sự tài_tình đảng ta ! đó mang những nhà_máy nhiệt_điện than cổ lổ sỉ từ người anh_em phương bắc về phục_vụ bà_con ! bà_con cám_ơn đảng nhà_nước chưa ?,Offensive,Clean
cực_kì thuyết_phục : 33,Clean,Offensive
xd,Clean,Offensive
cái này tao đéo đồng_ý,Clean,Hate
"tao phải qua phản_đối bọn ba_que indo nha , bác tao nhìn đẹp chai đoản hậu , lộn phúc_hậu_thế kia mà nó quất cặp môi như hai miếng thịt trâu làm thao",Hate,Offensive
chắc do đi đái quên chưa kéo quần ngoài vội quá nên kệ mẹ thế đi ra 😞,Offensive,Clean
khẩu_hiệu tuyệt_vời,Clean,Offensive
thôi đi cô cô xem hết mấy bài đăng trang này đi xem cô hùng_biện nũa hôn đảng cô đấy = ) hẹn mỹ,Clean,Hate
ae ăn tết đây ạ,Clean,Offensive
lo mà phụ mẹ giúp cha cực_kì thuyết_phục mả cha chúng_mày,Offensive,Clean
quốc_sư phải khỏe để lãnh_đạo 3 / chứ không thì 3 / biết đi đâu về đâu 😭 😭,Clean,Offensive
from thanh hoá with love . chúc bộ_tộc nghỉ lễ vv,Clean,Offensive
nể nhà_báo hoàng lân nhịn cười hay vãi . tao cười ngoác mồm . hay hơn game show nhìu,Hate,Clean
hay quá thầy ơi : ) ),Clean,Offensive
yêu xa khiến chúng_ta trưởng_thành hơn . . ! : ),Clean,Offensive
nhờ thầy mà giáo_án susan vẫn được tuyên_truyền rộng_rãi khắp cả nước 🤣 🤣,Clean,Hate
khoa ta bên hàn 1 người lây biết bn người kìa bn 10 người gì,Clean,Offensive
"á há há , army không ai giành giải best reaction mấy mẻ đâu mà la dữ = )",Clean,Offensive
khoai thị sắn,Clean,Hate
nguyễn nương ngà trần cuối tuần này ta chụp hình không,Clean,Offensive
ông nay giám vê vn không,Clean,Offensive
nguyễn thanh cẩm de bi ia chay lam,Offensive,Clean
tsb 💩,Clean,Hate
hài_lòng tao ghê : ),Clean,Offensive
đổi màu từ đỏ đậm thành nhạt hơn vì sương_gió ! nói đúng đấy chứ,Clean,Hate
thưa nhà tiên_tri biết khi nào việt_nam sẽ xóa sổ trung quốc_vậy ?,Hate,Clean
nhờ thầy mà em cảm_thấy mình không phải đứa chơi ngu nhất liên_minh,Hate,Offensive
troi ui con nay do lai_cai,Clean,Hate
doi song nay chet mai . can that voi loi noi se tot hon . ji hay ngheo tu minh bình thường khoe lay ji c d c oi,Clean,Hate
đỗ tài việt_kiều thích món thịt chó này không ? không,Offensive,Hate
lêu lêu mấy đứa fa 😂,Clean,Offensive
dạo này a lọt top show chart chỉ sau 20 du_khách hàn quốc thôi đấy . chúc_mừng a,Hate,Clean
ng hàn quốc sống thật lòng tốt mà tốt chưa thấy .,Clean,Hate
hoàng quốc hoàviết trung bữa_nay toàn thứ chi chi mô không ri !,Hate,Clean
h có_lẽ quá muộn_màng,Offensive,Hate
"cô mày . hiếu nói hòi nhỏ do nhà nghèo cô phải bỏ học bươn_chải đi hát lô_tô các thứ 😥 vậy nếu mẹ cô 100 cây vàng , thế sao phải để cô cực như_vậy ? ( tại không biết cô nói_chơi hay nói thiệt ) 😄",Offensive,Hate
mv khá chất_lượng,Clean,Hate
điên qf :,Clean,Hate
cái vấn_đề mà tấc nhiêng mà .,Clean,Hate
"bữa chưa xin dc tài_trợ từ liên_quan , h xin dc nên làm típ chăn 😌 🙄",Offensive,Hate
đi đường quyền hông,Clean,Hate
chuẩn_bị đóng thuế_oxy thôi mọi người : ),Clean,Hate
tiền đó công_khai ! ?,Clean,Hate
"hieu nguyen họ bùi ăn hết ông nội mày hả , đụ_mẹ mày lôi vào nói_chung_chung ý_thức mày cũng như con cặc",Clean,Offensive
? : d ?,Clean,Offensive
khổ thật_sự : ( (,Offensive,Hate
cà_khịa cực mạnh 🤣,Hate,Clean
mày nghỉ luôn cũng được . phát_ngôn tào_lao fan nó unfollow hết bây_giờ,Clean,Hate
"đục not "" đụt "" : 3",Offensive,Clean
huyền vy dẹp mẹ đi,Clean,Hate
phan văn_chương hôi lông cái hình đi đâu cũng đăng,Clean,Hate
gan trời = ),Clean,Hate
dlv đây chỉ trường hơp ngoại_lệ không tính : vậy,Clean,Hate
ảo_thuật,Clean,Offensive
ăn miếng coi,Clean,Hate
"sao mày ngu thế mày giỏi mày đi kêu_gọi mn xem người_ta góp mày không . mày thấy làm mệt quá à . người_ta tiền thì góp tiền , sức góp sức . còn mày cảm_thấy bất_công quá thì nghỉ con_mẹ mày đi làm từ_thiện đi . làm từ_thiện mà_lại so_sánh thiệt_hơn so so cái con cặc . mày tưởng mày bê được mấy cái thùng mì tôm mày to à",Offensive,Clean
"lê lê đọc tus không gì , đọc cmt cười ĩa : ) vậy không được đâu nha",Hate,Offensive
đến lúc nó chet lại sợ dai ra quần : ( (,Offensive,Clean
@ anh japan ☺ ️ liên_quan đến cậu sao,Offensive,Clean
mẹ tui cũng thích cô lắm á,Clean,Offensive
"bài này hoaprox mix giở , không điểm nhấn , nghe như nhạc mấy bà hát đám_cưới vậy . còn về jack hát 9,5 điểm r",Hate,Clean
ma ba vang ngoc 0907127749 mobi,Hate,Offensive
được vl anh độ ạ 😂,Hate,Clean
vì linh kháng_án lên tòa đại thẩm đến khi toà xử lại về luôn ở xứ em thiên_đường vậy đó mấy anh,Clean,Hate
a . di . da . phat . .,Offensive,Clean
tự_dưng anh mình tươi_cười áo hức thế . ủng_hộ a đi đóng qc tiếp a ơi . biểu_cảm nhiều hơn r,Hate,Clean
bà mẹ nó chửa lây người hà_nội luôn hok nói được lời gì cả con nầy hok biết nó còn hơn võ tắt_thiên nữa khẩu nghiệp nghe con đài loan linh lóc nghe nỡ mẹ kêu biệt_danh bắn nầy bắn ngọ_đồ khẩu nghiệp vậy_mà quản_cáo đi chùa xim trời phật con nầy chỉ pủi chứng nó thôi các bạn ơi hãy tẩy chai nó khỏi bán hàng onlai luôn đi cộng_đồng ơi,Clean,Offensive
thế nhìh xem dân đen chúng_ta bụng to hok,Clean,Offensive
xem bực_mình thêm,Clean,Offensive
ok a 😂 😂,Offensive,Hate
lại sống như rau_dền : ),Clean,Hate
. hí a zai,Clean,Hate
em nói thật e chưa bg cmt các page vậy_mà hà_cớ chi vô đây e lại thích ad mới chết . chắc ad ở ngoài hài_hước lắm ha . đọc sst mà cười_rụng_rốn haha,Clean,Offensive
bạn ba còn gạ bạn thơ vô to lét nữa : ),Clean,Offensive
chị dàu quá em con 10 triệu,Clean,Hate
tân_sơn nhất tấn hải . quan_ngại sâu_sắc,Hate,Clean
anh tôi anh tôi,Clean,Offensive
: (,Clean,Offensive
lê hiếu đọc cả bình_luận nữa,Hate,Clean
"dkm phat , noi nhu c",Clean,Hate
nguyễn thùy_linh : ),Clean,Hate
tấn thời bài này lần đầu nghe chả lọt taii gì cả . . nghe 2 - 3 lần thì cũng được nhưng không hay bằng mấy bài tr,Clean,Hate
bô sau khi hút thuốc_lào,Hate,Clean
"em ké tí ạ ! chuyên_mục thầm_kín chị_em phụ khang họ nguyễn 700k / 2 hộp trọn bộ đặt + uống + xông rửa . chuyên điều_trị viêm_nhiễm phụ_khoa , nấm ngứa . làm hồng se khít cô bé . liệu_trình dùng thử free ship toàn_quốc . inbox , call 📲 09848291",Offensive,Hate
trần trọng nghĩa thomas lee võ cao nhân justin bảo nguyễn nguyễn_phan tuệ thông cùng hy_vọng nào mn ơi : vậy,Clean,Hate
gắt quá ai_lại,Offensive,Hate
cường ông can à ? ! = ) ),Clean,Hate
dạo này nhìn ốm_yếu quá đi danh_hài ơi,Clean,Offensive
nam triệu nè thít hơm,Clean,Offensive
anh_em từ đây tui sẽ tạm_biệt tam kê gáy = ) ),Hate,Clean
"biết chửi không cô nương , ?",Hate,Clean
"duyên_dáng quá đi à nếu biết cô minh hiếu chắc_chắn sẽ biết tới tần đức bo meo meo , mọi người qua kênh ucra mình xem điều bất_ngờ nào . akajakkakak",Clean,Hate
"đậu mạ ! vịt nôm cái méo gì cũng có_thể xảy ra . trốn truy_nã tại địa_phương 26 năm , làm chánh văn_phòng tại địa_phương . tất_cả nhờ sự lãnh_đạo tài_tình đảng nhà_nước . dân ta cứ yên_tâm mà chết dần chết mòn đi",Clean,Hate
sao mọi người không đặt mình vào hoàn_cảnh này thì mình sẽ làm gì ? khi không tiền_bạc quyền_lực thì bạn làm được gì ? không an_ủi giúp_đỡ thì cũng bớt đi bình_luận nhé !,Clean,Hate
"dlv sẽ nói gì à ? ? : "" phản_đôôộoong ! - chỉ thế thôi nhé : vậy",Clean,Offensive
"cát linh hà đông hỏng phải thời tui đấu_thầu , thiết_kế nhé , đống sắt phế_thải , hàng quá đát đó thời trước nha , tui đang mê vụ 16 tỷ đô long thành airport thôi .",Clean,Offensive
chửi quá hay thích nhất cô minh hiếu cầm cái búa đập rất dễ_thương yêu_cầu làm tiếp phần sau,Hate,Clean
xứ tư_bản ba_que,Offensive,Clean
1 cặp : ) ),Clean,Hate
co minh hieu de thuong qua ik mai ham mo co,Clean,Offensive
chú ấy cũng bứt_rứt lương_tâm lắm rồi . .,Clean,Hate
"bò đỏ đâu ròi , tôi thấy cánh_tay các bạn nào : ) )",Clean,Hate
ý mua về kéo không lên nhưng tiếc,Clean,Hate
học_trò lol,Clean,Hate
chu ngọc khánh vân nhanh lém : vậy,Clean,Offensive
đây mới khiến nhiều người phải gục ngã nè 😍,Clean,Hate
chúc abe 20 - 10 vui_vẻ,Clean,Hate
du_học_sinh úc = ),Clean,Offensive
mãi yêu thầy ' dấu bé 3 ',Offensive,Clean
khá cayy 😂,Clean,Hate
đừng chê tiểu tiểu_😄,Clean,Hate
"trắng biến thành đen , biến thành không , không biến thành họ còn làm được chứ trắng biến thành xanh chuyện nhỏ",Offensive,Clean
from bến tre with love,Clean,Offensive
co nhiêm khong,Hate,Clean
nghe như đấm vào tai,Clean,Hate
phục_vụ quân dội bỏ stream,Hate,Offensive
"vậy_mà vẫn thua thi thi ak ,",Clean,Hate
dễ_thương xĩu i lớp diu chu cà_mo,Hate,Clean
thầy em phải hơn . nhưng ngu hơn ă 🤧,Clean,Hate
: ) ) abe lam susan 0175 de dau ik,Clean,Hate
chí quá thầy ơi,Clean,Offensive
chông chi trẻ va xinh qua,Clean,Offensive
trầm_cảm mất rồi quá mệt_mỏi tao / c gia_đình,Offensive,Hate
"chính_sách việt cộng ngu dân để trị , tài_giỏi thông_minh thì bị việt cộng bỏ_tù đúng rồi .",Offensive,Clean
một bài rất ý_nghĩa,Offensive,Hate
đợi nó chồng sinh con như âu cơ luôn đi ròi tối nhắn_tin tiếp : ),Clean,Offensive
"vietnam gioi thieu bo phim * benh nhan nguoi anh * bien dao dien , corona , dien vien uk , truong quay . vietnam .",Offensive,Clean
"lê trọng nghĩa phục làm gì bạn ? phục xong về hít bụi mịn , ăn đồ trộn hoá_chất , hộ_chiếu chỉ đi được châu phi với đông nam á như bạn hả ?",Clean,Hate
trông giống trú giể quá 😞,Hate,Clean
"nói bé thôi , đông lắm cơ : vậy",Clean,Hate
đừng đùa không khéo đem vào giảm dạy như mac lenin thì khối thằng ốm_đòn sách này 500k ít,Clean,Hate
"chửi vô_tội_vạ mà đéo biết báo từ đời_nào rồi , chỉ phạt các doanh_nghiệp mua điện nhưng lại không sử_dụng để tránh lãng_phí thôi chứ dân dùng bằng nào thu bằng đấy , toàn những con bò",Clean,Offensive
"chở vàng qua mỹ . đúng nhé chị ba chở . nhưng . không phải vàng mà bom , mìn , lựu_đạn . để nổ banh cái dòng_họ nhà thằng bê đê .",Hate,Clean
minh sang chưa bh bị như vậy : ) không mệt nổi vs mày mày yếu quá,Clean,Offensive
tức nước vỡ bờ . cả một lũ chó hại dân,Offensive,Hate
yên_tâm chính_phủ vn sẽ trả lại nhà tiên_tri,Clean,Offensive
chỉ mong việt_nam đón hè sớm một_chút : tuy nóng nhưng chết 🦠 virus,Clean,Hate
sau khi xài clear đến từ vị_trí abe,Offensive,Hate
vừa vào gr chưa làm được gì thì được làm fan cứng : ) p ? ?,Clean,Hate
bớt ảo tưỡng đi,Clean,Hate
thế các mày biết chưa,Clean,Hate
ân phan non : ) ),Clean,Offensive
"xử_lý chuyển công_tác lên tỉnh , tp : vậy",Offensive,Hate
nguyễn_vũ,Hate,Offensive
thích nghe thầy cười vl,Clean,Offensive
minh anh đến đoạn grab thì không còn nghi_ngờ gì nữa . kp hai đồng chi kiên kia . may vch .,Clean,Offensive
ổng nói lập kênh mới chứ không nói xóa_kênh cũ,Clean,Hate
avt hình ai z a ?,Clean,Offensive
căn_bản nhà nc không làm dc như thế . các chú bộ_đội hay 1 ban_ngày đi làm_vì lệnh phát ra trên đồn xuống chứ ai bão gió lũ_lụt chịu đi ăn_tiền dân nhận tiền thuế phải vậy kêu_ca gì,Clean,Offensive
thông_báo ad biết nhé hôm này giá xăng sẽ giảm mạnh nhé .,Offensive,Hate
đưa lên kiểu này khi ngày_mai nó người ra đập bỏ luôn hiểu nhé 😭,Offensive,Clean
quỳnh giao chắc bận đi bar nên không bh rep cmt chị_em : ),Clean,Offensive
dương quỳnh 😂,Clean,Hate
"anh mày thiếu nợ giang_hồ hóc_môn , mày cũng thiếu nợ không dám về việt_nam , bày đặc làm banh",Hate,Clean
doanh_nhân thành_đạt,Clean,Hate
chấp_nhận từ_bỏ,Clean,Hate
thắng từ thầy_giáo chuyển nghề thầy phù_thuỷ = ),Offensive,Clean
ngọc lành phạm xuân mai phương thảo phạm tường_vi ngọc bé phước hậu trần quốc duy phải_chi . mình cũng được vậy he cả nhà 😆,Offensive,Clean
ae nhìn kênh ba tú lần cuối,Clean,Hate
em làm fan cứng với em rất thích anh với anh hiếu lợn ạ : ' (,Clean,Offensive
mất thằng không cái nhạc dở_quoãi,Clean,Hate
bọn dầy tớ chấp chi .,Clean,Offensive
anh thích_đấu kiếm không ạ : ) ),Clean,Hate
nghe,Offensive,Hate
dạo này đồ rẻ các chú ạ : ( (,Offensive,Clean
về stream nhanh còn kịp anh ei 😂,Clean,Offensive
siêu tập_đoàn,Clean,Offensive
không lên lại hơi phí : vậy,Clean,Offensive
ủa lạc đâu ra mấy con chó này thế = ) ) tao bảo cno sống chậm thôi chứ tao bảo ông bà_già chúng mày sống chậm à mà vào sủa : ) ) ?,Clean,Offensive
ai lớp du . chu cờ mo = ),Clean,Offensive
hoàng oh men : ) ),Offensive,Clean
dep trai moi co nhieu dua yeu,Hate,Clean
